ID_0,NAME_0,FATALITIES,FATALITIES_GROUND_SHAKING,MISSING,INJURIES,DISPLACED_POPULATION,AFFECTED_POPULATION,AFFECTED_UNITS,DAMAGED_UNITS,COLLAPSED_UNITS,UNIT_TYPES,ECONOMIC_LOSSES,RECONSTRUCTION_COST,INSURED_LOSSES,CURRENCY,INDUCED_EFFECTS,FLAG,REFERENCE,COMMENTS,INJURIES_LIGHT,INJURIES_SEVERE,INJURIES_CRITICAL,HOMELESS,SHELTERED,DS1_SLIGHT,DS2_MODERATE,DS3_EXTENSIVE,DS4_COMPLETE,DAMAGED_NOT_DESTROYED,TAXONOMY,GEM_TAXONOMY,OCCUPANCY
HTI,Haiti,2577,2577,329,12763,,,,137585,53815,,1.60E+09,,,USD,,,NOAA,Assuming collapsed buildings and D4 = destroyed houses,,,,,,,,,53815,83770,,,
HTI,Haiti,2575,2575,,12763,,702763,,,,,1620071000,1.98E+09,,USD,,,EM-DAT,n/a,,,,,,,,,,,,,
HTI,Haiti,>2529,>2529,329,>12500,,800000,,,115000,,,,,,,,Haiti Civil Protection Agency,Assuming collapsed buildings and D4 = destroyed houses,,,,,,,,,115000,,,,
HTI,Haiti,,,,,,,,137000,61000,,,,,,,,StEER_2021,Assuming collapsed buildings and D4 = destroyed houses,,,,,,,,,61000,76000,,,
HTI,Haiti,,,,,220000,,,,,,,,,,,,IDMC,,,,,,,,,,,,,,