OBS_272,ADAMCLISI (ROM) (Intensity VI),27.951,44.085,macroseismic,0.09736,0.8059,,325.45,inferred,504.0
OBS_382,FALESTI (MLD) (Intensity VI),27.71,47.58,macroseismic,0.097352,0.8059,,567.64,inferred,727.0
OBS_350,CORNI (ROM) (Intensity VI),26.574,47.645,macroseismic,0.097295,0.8059,,404.2,inferred,403.0
OBS_416,IPOTESTI (ROM) (Intensity VI),26.288,47.622,macroseismic,0.097148,0.8059,,625.17,inferred,592.0
OBS_385,FRATESTI1 (ROM) (Intensity VI),25.97,43.97,macroseismic,0.097064,0.8059,,279.86,inferred,280.0
OBS_359,CRISAN (ROM) (Intensity VI),29.39,45.174,macroseismic,0.09702,0.8059,,181.29,inferred,201.0
OBS_561,TOPANA/GEAMANA (ROM) (Intensity VI),24.501,44.829,macroseismic,0.096886,0.8059,,316.16,inferred,253.0
OBS_274,ALBESTI (ROM) (Intensity VI),27.072,47.691,macroseismic,0.096881,0.8059,,638.49,inferred,776.0
OBS_552,TATARBUNARI (UKR) (Intensity VI),29.62,45.84,macroseismic,0.096694,0.8059,,358.05,inferred,435.0
OBS_595,VLADESTI/VALCEA (ROM) (Intensity VI),24.287,45.124,macroseismic,0.096654,0.8059,,744.73,inferred,390.0
OBS_517,SALAGENI (ROM) (Intensity VI),26.38,47.679,macroseismic,0.096609,0.8059,,550.0,inferred,599.0
OBS_487,POARTA_ALBA (ROM) (Intensity VI),28.397,44.208,macroseismic,0.096559,0.8059,,434.53,inferred,370.0
OBS_273,AGAFTON (ROM) (Intensity VI),26.593,47.712,macroseismic,0.09647,0.8059,,711.22,inferred,732.0
OBS_328,CAUSANI (MLD) (Intensity VI),29.41,46.64,macroseismic,0.096461,0.8059,,844.36,inferred,619.0
OBS_519,SARATA (UKR) (Intensity VI),29.66,46.03,macroseismic,0.096261,0.8059,,528.99,inferred,711.0
OBS_454,MURFATLAR(BASARABI) (ROM) (Intensity VI),28.41,44.174,macroseismic,0.096143,0.8059,,394.96,inferred,291.0
OBS_318,C.A.ROSETTI (ROM) (Intensity VI),29.566,45.299,macroseismic,0.096068,0.8059,,239.98,inferred,240.0
OBS_340,CIOCARLIA_DE_SUS (ROM) (Intensity VI),28.333,44.117,macroseismic,0.095955,0.8059,,327.16,inferred,330.0
OBS_564,TRUSESTI1 (ROM) (Intensity VI),27.007,47.77,macroseismic,0.095903,0.8059,,793.62,inferred,282.0
OBS_573,VADUL_LUI_VODA (MLD) (Intensity VI),29.08,47.09,macroseismic,0.09589,0.8059,,899.77,inferred,900.0
OBS_541,SUVOROVO (MLD) (Intensity VI),29.663,45.51,macroseismic,0.095884,0.8059,,600.0,inferred,600.0
OBS_442,MARACENII_VALE (ROM) (Intensity VI),24.8,44.4,macroseismic,0.095852,0.8059,,288.46,inferred,288.0
OBS_319,CALAMARASTI_DEAL (ROM) (Intensity VI),26.603,47.765,macroseismic,0.095833,0.8059,,597.81,inferred,598.0
OBS_403,GORBANESTI (ROM) (Intensity VI),26.86,47.778,macroseismic,0.095806,0.8059,,607.31,inferred,403.0
OBS_603,ZAVET (BUL) (Intensity VI),26.667,43.767,macroseismic,0.095723,0.8059,,278.43,inferred,278.0
OBS_485,PLAKHTIEVKA (UKR) (Intensity VI),29.72,46.1,macroseismic,0.09566,0.8059,,511.39,inferred,289.0
OBS_522,SCORNICESTI1 (ROM) (Intensity VI),24.548,44.589,macroseismic,0.095621,0.8059,,377.0,inferred,286.0
OBS_537,STEFANESTI/BOTOSANI (ROM) (Intensity VI),27.201,47.79,macroseismic,0.095567,0.8059,,285.69,inferred,611.0
OBS_323,CALINESTI/TELEORMAN (ROM) (Intensity VI),25.245,44.087,macroseismic,0.09546,0.8059,,343.36,inferred,269.0
OBS_367,DOBROTESTI1 (ROM) (Intensity VI),24.885,44.273,macroseismic,0.095277,0.8059,,244.43,inferred,261.0
OBS_372,DRAGOESTI1 (ROM) (Intensity VI),24.292,44.826,macroseismic,0.095237,0.8059,,432.2,inferred,433.0
OBS_393,GEAMANA1 (ROM) (Intensity VI),24.304,44.805,macroseismic,0.095211,0.8059,,415.49,inferred,443.0
OBS_417,ISPERIH (BUL) (Intensity VI),26.83,43.71,macroseismic,0.095065,0.8059,,299.84,inferred,194.0
OBS_534,SIRINEASA1 (ROM) (Intensity VI),24.185,44.94,macroseismic,0.094999,0.8059,,432.17,inferred,545.0
OBS_401,GOGOSARI1 (ROM) (Intensity VI),25.712,43.859,macroseismic,0.094958,0.8059,,288.31,inferred,273.0
OBS_368,DOBROTESTI2 (ROM) (Intensity VI),24.883,44.233,macroseismic,0.094914,0.8059,,273.11,inferred,244.0
OBS_467,ORHEI (MLD) (Intensity VI),28.83,47.38,macroseismic,0.094906,0.8059,,508.37,inferred,900.0
OBS_357,CRAMPOAIA (ROM) (Intensity VI),24.746,44.306,macroseismic,0.094732,0.8059,,255.18,inferred,296.0
OBS_347,CONSTANTA1 (ROM) (Intensity VI),28.637,44.147,macroseismic,0.094678,0.8059,,388.42,inferred,423.0
OBS_289,BALTI (MLD) (Intensity VI),27.92,47.76,macroseismic,0.094675,0.8059,,315.13,inferred,469.0
OBS_460,NICOLAE_TITULESCU (ROM) (Intensity VI),24.777,44.275,macroseismic,0.094659,0.8059,,360.85,inferred,231.0
OBS_384,FOLESTII_DE_SUS (ROM) (Intensity VI),24.058,45.092,macroseismic,0.094654,0.8059,,602.51,inferred,501.0
OBS_523,SCUNDU (ROM) (Intensity VI),24.187,44.841,macroseismic,0.094527,0.8059,,402.01,inferred,247.0
OBS_539,STEJARU (ROM) (Intensity VI),24.883,44.183,macroseismic,0.094476,0.8059,,284.58,inferred,327.0
OBS_512,ROSIORI_DE_VEDE1 (ROM) (Intensity VI),24.994,44.111,macroseismic,0.094427,0.8059,,230.28,inferred,293.0
OBS_584,VEDEA (ROM) (Intensity VI),25.785,43.781,macroseismic,0.094335,0.8059,,192.69,inferred,213.0
OBS_562,TOPRAISAR (ROM) (Intensity VI),28.454,44.012,macroseismic,0.094332,0.8059,,255.87,inferred,230.0
OBS_437,MALDARESTI (ROM) (Intensity VI),23.998,45.122,macroseismic,0.094299,0.8059,,399.37,inferred,341.0
OBS_461,NIKOLAEVKA_NOVOROSISKAYA (UKR) (Intensity VI),29.91,46.13,macroseismic,0.094069,0.8059,,420.97,inferred,488.0
OBS_502,RASCAETI (MLD) (Intensity VI),29.78,46.57,macroseismic,0.093931,0.8059,,706.23,inferred,837.0
OBS_420,KAOLINOVO (BUL) (Intensity VI),27.134,43.616,macroseismic,0.093827,0.8059,,393.84,inferred,270.0
OBS_358,CRETENI (ROM) (Intensity VI),24.183,44.71,macroseismic,0.093803,0.8059,,327.84,inferred,460.0
OBS_292,BARCANESTI/BREBENI (ROM) (Intensity VI),24.548,44.306,macroseismic,0.093548,0.8059,,435.59,inferred,399.0
OBS_538,STEFANESTI/VALCEA (ROM) (Intensity VI),24.218,44.618,macroseismic,0.093523,0.8059,,430.19,inferred,412.0
OBS_514,RUNCU_MARE (ROM) (Intensity VI),24.269,44.556,macroseismic,0.093493,0.8059,,281.94,inferred,283.0
OBS_458,NEGRU_VODA (ROM) (Intensity VI),28.213,43.818,macroseismic,0.093451,0.8059,,282.21,inferred,271.0
OBS_508,RISCANI (MLD) (Intensity VI),27.56,47.95,macroseismic,0.093326,0.8059,,382.16,inferred,482.0
OBS_421,KARDAM (BUL) (Intensity VI),28.108,43.754,macroseismic,0.093188,0.8059,,350.03,inferred,325.0
OBS_284,BACALESTI (ROM) (Intensity VI),24.817,44.066,macroseismic,0.093129,0.8059,,240.12,inferred,226.0
OBS_477,PECINEAGA (ROM) (Intensity VI),28.495,43.895,macroseismic,0.093056,0.8059,,263.76,inferred,274.0
OBS_505,RAZGRAD1 (BUL) (Intensity VI),26.512,43.53,macroseismic,0.092908,0.8059,,396.36,inferred,366.0
OBS_394,GENERAL_TOSHEVO (BUL) (Intensity VI),28.033,43.7,macroseismic,0.092893,0.8059,,297.69,inferred,298.0
OBS_282,AUGUST-23 (ROM) (Intensity VI),28.581,43.917,macroseismic,0.092881,0.8059,,324.04,inferred,308.0
OBS_499,RADOMIRESTI1 (ROM) (Intensity VI),24.68,44.117,macroseismic,0.092836,0.8059,,252.52,inferred,227.0
OBS_521,SARBESTI (ROM) (Intensity VI),23.793,45.117,macroseismic,0.092766,0.8059,,507.89,inferred,461.0
OBS_378,DVE_MOGILI (BUL) (Intensity VI),25.867,43.6,macroseismic,0.092648,0.8059,,443.13,inferred,443.0
OBS_370,DOROBANTU/SEACA (ROM) (Intensity VI),24.824,43.992,macroseismic,0.092548,0.8059,,293.76,inferred,306.0
OBS_371,DRAGANESTI/OLT1 (ROM) (Intensity VI),24.52,44.17,macroseismic,0.092383,0.8059,,460.59,inferred,259.0
OBS_575,VALEA_MARE/BALCESTI (ROM) (Intensity VI),24.0,44.668,macroseismic,0.092339,0.8059,,452.53,inferred,453.0
OBS_557,TETOIU (ROM) (Intensity VI),23.901,44.774,macroseismic,0.092186,0.8059,,433.96,inferred,441.0
OBS_381,FALCOIU (ROM) (Intensity VI),24.376,44.23,macroseismic,0.092015,0.8059,,212.95,inferred,217.0
OBS_469,OSCICA_DE_SUS (ROM) (Intensity VI),24.315,44.254,macroseismic,0.091835,0.8059,,356.63,inferred,257.0
OBS_466,OPAKA (BUL) (Intensity VI),26.16,43.45,macroseismic,0.091683,0.8059,,423.94,inferred,677.0
OBS_483,PIATRA/OLT3 (ROM) (Intensity VI),24.148,44.371,macroseismic,0.091614,0.8059,,256.17,inferred,444.0
OBS_470,OSICA_DE_JOS (ROM) (Intensity VI),24.28,44.244,macroseismic,0.091573,0.8059,,360.69,inferred,316.0
OBS_567,TURNU_MAGURELE2 (ROM) (Intensity VI),25.0,43.767,macroseismic,0.091432,0.8059,,390.34,inferred,390.0
HIST_5,Bucharest-Magurele,26.03,44.347,seismic,0.091429,0.0,,227.45,inferred,267.0
ADJ,Adjud,27.181,46.095,seismic,0.09142,0.0,,260.46,inferred,258.0
BUC,BUC,26.02,44.21,seismic,0.0914,0.0,,222.1,inferred,250.0
OBS_431,LOGRESTI (ROM) (Intensity VI),23.705,44.896,macroseismic,0.091387,0.8059,,463.88,inferred,314.0
OBS_544,SVISHTOV (BUL) (Intensity VI),25.35,43.61,macroseismic,0.091311,0.8059,,433.88,inferred,562.0
OBS_377,DURAN_KULAK (BUL) (Intensity VI),28.517,43.7,macroseismic,0.091242,0.8059,,293.87,inferred,310.0
OBS_300,BERLESTI (ROM) (Intensity VI),23.667,44.917,macroseismic,0.091217,0.8059,,423.95,inferred,291.0
BAA,Baia-Tulcea,28.679,44.723,seismic,0.0911,0.0,,371.54,inferred,264.0
OBS_326,CARACAL1 (ROM) (Intensity VI),24.347,44.114,macroseismic,0.091068,0.8059,,260.75,inferred,307.0
OBS_434,LUNCA/MAGURELE (ROM) (Intensity VI),24.769,43.836,macroseismic,0.091037,0.8059,,258.58,inferred,259.0
OBS_516,SAELELE1 (ROM) (Intensity VI),24.724,43.857,macroseismic,0.091006,0.8059,,486.63,inferred,254.0
OBS_302,BIALA (BUL) (Intensity VI),25.73,43.45,macroseismic,0.090875,0.8059,,433.66,inferred,483.0
OBS_296,BELENE (BUL) (Intensity VI),25.117,43.646,macroseismic,0.090844,0.8059,,223.92,inferred,261.0
TLC2,Tulcea-Prim.,28.804,45.176,seismic,0.09082,0.0,,417.41,inferred,443.0
OBS_297,BELGOROD_DNESTROVSKIY (UKR) (Intensity VI),30.35,46.2,macroseismic,0.090779,0.8059,,600.0,inferred,445.0
OBS_438,MALFESTI (ROM) (Intensity VI),23.753,44.651,macroseismic,0.090684,0.8059,,471.64,inferred,286.0
OBS_569,UNGURENI/CRAIOVA (ROM) (Intensity VI),23.943,44.401,macroseismic,0.090591,0.8059,,244.98,inferred,238.0
OBS_596,VLADIA (ROM) (Intensity VI),24.4,44.0,macroseismic,0.090554,0.8059,,263.72,inferred,264.0
OBS_462,NIKOPOL (BUL) (Intensity VI),24.9,43.7,macroseismic,0.090489,0.8059,,576.22,inferred,576.0
OBS_507,REDEA/CARACAL1 (ROM) (Intensity VI),24.299,44.055,macroseismic,0.090428,0.8059,,215.99,inferred,222.0
OBS_475,PARAU_BOIA (ROM) (Intensity VI),23.536,44.926,macroseismic,0.090413,0.8059,,390.27,inferred,419.0
OBS_559,TIRGU_CARBUNESTI1 (ROM) (Intensity VI),23.507,44.959,macroseismic,0.090343,0.8059,,306.79,inferred,360.0
OBS_498,RADOMIR (ROM) (Intensity VI),24.164,44.123,macroseismic,0.09018,0.8059,,229.82,inferred,215.0
OBS_311,BRASTAVATU (ROM) (Intensity VI),24.409,43.907,macroseismic,0.089954,0.8059,,259.7,inferred,297.0
OBS_589,VISINA_NOUA1 (ROM) (Intensity VI),24.414,43.87,macroseismic,0.089721,0.8059,,283.35,inferred,234.0
OBS_429,LEU1 (ROM) (Intensity VI),24.0,44.188,macroseismic,0.089717,0.8059,,229.32,inferred,214.0
OBS_353,COSOVENI1 (ROM) (Intensity VI),23.933,44.25,macroseismic,0.089712,0.8059,,187.63,inferred,232.0
OBS_590,VISINA_NOUA2 (ROM) (Intensity VI),24.377,43.886,macroseismic,0.089664,0.8059,,255.33,inferred,263.0
OBS_331,CELARU1 (ROM) (Intensity VI),24.113,44.052,macroseismic,0.089485,0.8059,,252.03,inferred,264.0
OBS_349,CORABIA (ROM) (Intensity VI),24.501,43.78,macroseismic,0.089473,0.8059,,295.9,inferred,219.0
OBS_354,COSOVENI2 (ROM) (Intensity VI),23.878,44.253,macroseismic,0.089435,0.8059,,262.22,inferred,276.0
OBS_356,COTOFENI_DIN_FATA (ROM) (Intensity VI),23.657,44.459,macroseismic,0.089253,0.8059,,470.39,inferred,363.0
OBS_555,TATOMIRESTI (ROM) (Intensity VI),23.598,44.516,macroseismic,0.089175,0.8059,,434.92,inferred,441.0
OBS_572,VADASTRITA (ROM) (Intensity VI),24.33,43.841,macroseismic,0.089151,0.8059,,273.61,inferred,298.0
OBS_277,AMARASTII_DE_JOS (ROM) (Intensity VI),24.166,43.955,macroseismic,0.08914,0.8059,,182.16,inferred,221.0
OBS_488,PODARI (ROM) (Intensity VI),23.783,44.25,macroseismic,0.088918,0.8059,,332.67,inferred,324.0
OBS_570,URZICA_MARE (ROM) (Intensity VI),23.594,44.015,macroseismic,0.088526,0.8059,,235.08,inferred,226.0
OBS_497,RACOVITA/DOLJ (ROM) (Intensity VI),23.434,44.52,macroseismic,0.088526,0.8059,,455.44,inferred,350.0
OBS_376,DUMBRAVA_DE_JOS (ROM) (Intensity VI),23.164,44.524,macroseismic,0.088526,0.8059,,397.93,inferred,412.0
OBS_436,MACESU_DE_SUS (ROM) (Intensity VI),23.7,43.915,macroseismic,0.088526,0.8059,,285.98,inferred,330.0
OBS_366,DOBRIBOR (ROM) (Intensity VI),23.168,44.119,macroseismic,0.088526,0.8059,,244.4,inferred,226.0
OBS_402,GOGOSU (ROM) (Intensity VI),23.377,44.425,macroseismic,0.088526,0.8059,,333.12,inferred,262.0
OBS_413,IANCA_NOUA (ROM) (Intensity VI),24.212,43.821,macroseismic,0.088526,0.8059,,242.4,inferred,286.0
OBS_495,PUNGHINA (ROM) (Intensity VI),22.935,44.282,macroseismic,0.088526,0.8059,,231.41,inferred,277.0
OBS_443,MARACHINELE/DOLJ (ROM) (Intensity VI),23.512,44.176,macroseismic,0.088526,0.8059,,296.21,inferred,278.0
OBS_585,VELA1 (ROM) (Intensity VI),23.421,44.28,macroseismic,0.088526,0.8059,,283.24,inferred,399.0
OBS_324,CALOPAR (ROM) (Intensity VI),23.767,44.167,macroseismic,0.088526,0.8059,,228.0,inferred,228.0
OBS_526,SECU (ROM) (Intensity VI),23.292,44.475,macroseismic,0.088526,0.8059,,343.56,inferred,335.0
OBS_308,BOTOSESTI_PAIA (ROM) (Intensity VI),23.257,44.405,macroseismic,0.088526,0.8059,,307.44,inferred,298.0
OBS_329,CAZANESTI/MEHEDINTI1 (ROM) (Intensity VI),22.968,44.708,macroseismic,0.088526,0.8059,,517.6,inferred,502.0
OBS_440,MALOVAT (ROM) (Intensity VI),22.731,44.704,macroseismic,0.088526,0.8059,,518.98,inferred,519.0
OBS_478,PERISOR (ROM) (Intensity VI),23.49,44.143,macroseismic,0.088526,0.8059,,252.66,inferred,279.0
OBS_374,DRANIC (ROM) (Intensity VI),23.845,44.055,macroseismic,0.088526,0.8059,,282.87,inferred,282.0
OBS_389,GANGIORA (ROM) (Intensity VI),23.856,43.902,macroseismic,0.088526,0.8059,,262.67,inferred,321.0
OBS_576,VALEA_STANCIULUI (ROM) (Intensity VI),23.872,43.986,macroseismic,0.088526,0.8059,,336.5,inferred,389.0
OBS_321,CALARASI/DOLJ (ROM) (Intensity VI),24.047,43.819,macroseismic,0.088526,0.8059,,241.14,inferred,309.0
OBS_362,DABULENI (ROM) (Intensity VI),24.092,43.8,macroseismic,0.088526,0.8059,,341.06,inferred,341.0
OBS_397,GIUBEGA (ROM) (Intensity VI),23.411,44.122,macroseismic,0.088526,0.8059,,263.39,inferred,285.0
OBS_312,BREZNITA-MOTRU (ROM) (Intensity VI),23.22,44.57,macroseismic,0.088526,0.8059,,626.38,inferred,287.0
OBS_399,GOANTA (ROM) (Intensity VI),22.96,44.233,macroseismic,0.088526,0.8059,,414.93,inferred,395.0
OBS_472,PADEA (ROM) (Intensity VI),23.868,44.02,macroseismic,0.088526,0.8059,,373.4,inferred,393.0
OBS_455,MURGILESTI (ROM) (Intensity VI),23.112,44.747,macroseismic,0.088526,0.8059,,354.75,inferred,387.0
OBS_586,VERBITA1 (ROM) (Intensity VI),23.17,44.248,macroseismic,0.088526,0.8059,,381.25,inferred,232.0
OBS_527,SEGARCEA1 (ROM) (Intensity VI),23.746,44.094,macroseismic,0.088526,0.8059,,416.75,inferred,423.0
OBS_291,BARCA1 (ROM) (Intensity VI),23.629,43.982,macroseismic,0.088526,0.8059,,250.56,inferred,278.0
OBS_309,BRABOVA (ROM) (Intensity VI),23.456,44.371,macroseismic,0.088526,0.8059,,443.98,inferred,318.0
OBS_479,PESTEANA_DE_JOS (ROM) (Intensity VI),23.268,44.83,macroseismic,0.088526,0.8059,,507.74,inferred,508.0
OBS_592,VLADAIA (ROM) (Intensity VI),23.028,44.357,macroseismic,0.088526,0.8059,,399.85,inferred,298.0
OBS_304,BIRZA (ROM) (Intensity VI),23.939,44.001,macroseismic,0.088526,0.8059,,340.93,inferred,324.0
OBS_529,SILISTEA_CRUCII (ROM) (Intensity VI),23.475,44.045,macroseismic,0.088526,0.8059,,215.98,inferred,257.0
OBS_468,ORODEL1 (ROM) (Intensity VI),23.243,44.244,macroseismic,0.088526,0.8059,,340.44,inferred,371.0
OBS_486,PLENITA1 (ROM) (Intensity VI),23.189,44.221,macroseismic,0.088526,0.8059,,262.09,inferred,406.0
OBS_581,VANJULET (ROM) (Intensity VI),22.792,44.441,macroseismic,0.088526,0.8059,,243.66,inferred,250.0
OBS_525,SEACA_DE_CAMP/DOLJ (ROM) (Intensity VI),23.217,43.934,macroseismic,0.088526,0.8059,,272.21,inferred,274.0
OBS_288,BALACITA (ROM) (Intensity VI),23.13,44.383,macroseismic,0.088526,0.8059,,255.06,inferred,325.0
MLT,Buc.-Militari,26.028,44.431,seismic,0.08564,0.0,,234.25,inferred,196.0
MTR,Buc.-Metrou IMGB-1,26.144,44.367,seismic,0.08442,0.0,,216.77,inferred,203.0
OBS_619,GOTESTI (MLD) (Intensity VI),28.17,46.14,macroseismic,0.083158,0.8059,,477.42,inferred,534.0
PLS,Ploiesti-Vest,26.02,44.93,seismic,0.08307,0.0,,277.67,inferred,267.0
CHI4,Chisinau-Iss4,28.874,47.061,seismic,0.08263,0.0,,464.98,inferred,694.0
BRL1,Braila,27.966,45.269,seismic,0.08124,0.0,,262.45,inferred,262.0
MET,Buc.-Metalurgiei/Berceni,26.119,44.376,seismic,0.07647,0.0,,216.77,inferred,244.0
OBS_632,VALEA_PERJEI (MLD) (Intensity VI),28.93,46.03,macroseismic,0.075937,0.8059,,570.98,inferred,571.0
OBS_609,CARACUI (MLD) (Intensity VI),28.54,46.7,macroseismic,0.075899,0.8059,,814.0,inferred,638.0
HIST_3,Bucharest Armeneasca,26.09,44.4,seismic,0.075408,0.0,,241.47,inferred,228.0
OBS_612,COSTIUJENI (MLD) (Intensity VI),28.83,46.95,macroseismic,0.07238,0.8059,,673.84,inferred,889.0
OBS_611,CELACUL-NOU (MLD) (Intensity VI),27.83,47.48,macroseismic,0.071994,0.8059,,704.75,inferred,416.0
OBS_630,SLIVO_POLE1 (BUL) (Intensity VI),26.2,43.95,macroseismic,0.071368,0.8059,,270.46,inferred,255.0
TLC1,Tulcea-Sc.,28.8,45.167,seismic,0.07086,0.0,,417.41,inferred,417.0
OBS_634,VILKOVO (UKR) (Intensity VI),29.6,45.39,macroseismic,0.070397,0.8059,,207.26,inferred,212.0
OBS_616,ERMOCLIA (MLD) (Intensity VI),29.51,46.58,macroseismic,0.070298,0.8059,,822.26,inferred,629.0
OBS_635,VOLONTIROVCA (MLD) (Intensity VI),29.61,46.43,macroseismic,0.070153,0.8059,,646.07,inferred,769.0
OBS_621,LAZOVSC (MLD) (Intensity VI),28.14,47.64,macroseismic,0.069838,0.8059,,316.6,inferred,885.0
OBS_606,BENDER (MLD) (Intensity VI),29.47,46.82,macroseismic,0.069616,0.8059,,724.96,inferred,266.0
OBS_607,BUTUCENI (MLD) (Intensity VI),28.97,47.3,macroseismic,0.069479,0.8059,,899.99,inferred,900.0
BLA,Buc.-Balta Alba,26.169,44.413,seismic,0.06907,0.0,,231.11,inferred,270.0
TIT,Buc.-Titulescu,26.08,44.452,seismic,0.06882,0.0,,222.57,inferred,253.0
OBS_608,CAPLANI (MLD) (Intensity VI),29.87,46.39,macroseismic,0.068748,0.8059,,786.93,inferred,785.0
OBS_610,CAR_KALOIAN (BUL) (Intensity VI),26.25,43.61,macroseismic,0.068487,0.8059,,385.69,inferred,493.0
OBS_613,DNESTROVSC (MLD) (Intensity VI),29.91,46.62,macroseismic,0.067996,0.8059,,289.01,inferred,466.0
OBS_615,DROCHIA (MLD) (Intensity VI),27.81,48.04,macroseismic,0.067382,0.8059,,380.45,inferred,451.0
MLR,Muntele Rosu,25.944,45.492,seismic,0.06696,0.0,,880.31,inferred,874.0
OBS_614,DRALFA/TYRGOVISHTE (BUL) (Intensity VI),26.43,43.34,macroseismic,0.066593,0.8059,,226.86,inferred,289.0
OBS_624,ORESH (BUL) (Intensity VI),25.23,43.58,macroseismic,0.066418,0.8059,,459.13,inferred,520.0
OBS_637,VYLCHI_DOL (BUL) (Intensity VI),27.55,43.33,macroseismic,0.066216,0.8059,,404.41,inferred,362.0
OBS_617,FRUNZIVKA (UKR) (Intensity VI),29.76,47.33,macroseismic,0.066167,0.8059,,859.17,inferred,245.0
OBS_626,POLSKI_TRUMBESH (BUL) (Intensity VI),25.65,43.382,macroseismic,0.065989,0.8059,,253.52,inferred,271.0
OBS_622,LOZEN/VEL.TURNOVO (BUL) (Intensity VI),25.88,43.33,macroseismic,0.065989,0.8059,,317.6,inferred,471.0
OBS_605,BALCHIK (BUL) (Intensity VI),28.16,43.41,macroseismic,0.065825,0.8059,,600.0,inferred,623.0
OBS_629,SHABLA (BUL) (Intensity VI),28.533,43.533,macroseismic,0.06578,0.8059,,266.86,inferred,267.0
OBS_618,GABROVO (BUL) (Intensity VI),25.326,42.862,macroseismic,0.064854,0.8059,,555.01,inferred,421.0
OBS_620,KOZLODUY (BUL) (Intensity VI),23.732,43.782,macroseismic,0.064854,0.8059,,296.01,inferred,255.0
OBS_625,PAVLIKENI (BUL) (Intensity VI),25.322,43.243,macroseismic,0.064854,0.8059,,436.87,inferred,440.0
OBS_633,VELIKO_TURNOVO (BUL) (Intensity VI),25.652,43.078,macroseismic,0.064854,0.8059,,445.56,inferred,492.0
OBS_604,APRILCI (BUL) (Intensity VI),24.93,42.85,macroseismic,0.064854,0.8059,,900.0,inferred,608.0
OBS_631,TRASTENIK (BUL) (Intensity VI),24.472,43.521,macroseismic,0.064854,0.8059,,326.53,inferred,317.0
OBS_623,NOVO_SELO (BUL) (Intensity VI),22.783,44.159,macroseismic,0.064854,0.8059,,261.42,inferred,296.0
OBS_636,VYLCHIDRYM (BUL) (Intensity VI),23.445,43.696,macroseismic,0.064854,0.8059,,309.26,inferred,338.0
OBS_628,SEVLIEVO (BUL) (Intensity VI),25.116,43.024,macroseismic,0.064854,0.8059,,326.75,inferred,280.0
OBS_627,PORDIM (BUL) (Intensity VI),24.85,43.383,macroseismic,0.064854,0.8059,,314.71,inferred,253.0
CRV,Craiova,23.798,44.321,seismic,0.06368,0.0,,281.01,inferred,298.0
BOZ,Bozveli,27.479,43.105,seismic,0.06143,0.0,,502.99,inferred,328.0
OBS_789,OCLAND_HARGHITA (ROM) (Intensity V),25.425,46.162,macroseismic,0.058959,0.8059,,553.6,inferred,415.0
OBS_680,CAPALNITA (ROM) (Intensity V),25.514,46.359,macroseismic,0.058456,0.8059,,544.18,inferred,400.0
OBS_819,RUCAR (ROM) (Intensity V),25.176,45.39,macroseismic,0.05762,0.8059,,507.39,inferred,372.0
OBS_867,ULIES (ROM) (Intensity V),25.242,46.211,macroseismic,0.057493,0.8059,,522.97,inferred,339.0
OBS_796,ORDORHEIU_SECUIESC (ROM) (Intensity V),25.301,46.313,macroseismic,0.057399,0.8059,,470.49,inferred,413.0
OBS_860,TICUSU_VECHI (ROM) (Intensity V),25.1,45.928,macroseismic,0.057369,0.8059,,339.17,inferred,365.0
OBS_773,MUGENI (ROM) (Intensity V),25.218,46.259,macroseismic,0.057137,0.8059,,383.19,inferred,427.0
OBS_759,MANDRA (ROM) (Intensity V),25.047,45.821,macroseismic,0.057132,0.8059,,240.98,inferred,285.0
OBS_691,DEALU (ROM) (Intensity V),25.304,46.396,macroseismic,0.056992,0.8059,,889.45,inferred,889.0
OBS_706,GHEORGHENI (ROM) (Intensity V),25.614,46.719,macroseismic,0.056769,0.8059,,489.75,inferred,309.0
OBS_639,ALBESTII_DE_MUSCEL4 (ROM) (Intensity V),25.063,45.354,macroseismic,0.056745,0.8059,,538.43,inferred,554.0
OBS_755,LUPENI/CORUND (ROM) (Intensity V),25.224,46.379,macroseismic,0.056623,0.8059,,410.88,inferred,383.0
OBS_814,RECEA (ROM) (Intensity V),24.944,45.732,macroseismic,0.056459,0.8059,,354.07,inferred,355.0
OBS_874,VARZAG (ROM) (Intensity V),25.345,46.537,macroseismic,0.056444,0.8059,,316.59,inferred,441.0
OBS_727,JOSENI (ROM) (Intensity V),25.501,46.701,macroseismic,0.056333,0.8059,,288.36,inferred,288.0
OBS_670,BREAZA (ROM) (Intensity V),24.882,45.706,macroseismic,0.056045,0.8059,,455.53,inferred,377.0
OBS_864,TULGHES (ROM) (Intensity V),25.757,46.95,macroseismic,0.055773,0.8059,,566.09,inferred,455.0
OBS_660,BODOGAIA (ROM) (Intensity V),24.996,46.274,macroseismic,0.05576,0.8059,,361.82,inferred,470.0
OBS_815,REMETEA/HARGHITA (ROM) (Intensity V),25.453,46.793,macroseismic,0.055567,0.8059,,226.92,inferred,340.0
OBS_871,VANATORI/MURES (ROM) (Intensity V),24.926,46.242,macroseismic,0.055469,0.8059,,526.99,inferred,457.0
OBS_686,CINCU (ROM) (Intensity V),24.803,45.916,macroseismic,0.055429,0.8059,,501.39,inferred,394.0
OBS_688,CORBU/HARGHITA (ROM) (Intensity V),25.705,46.987,macroseismic,0.055327,0.8059,,561.99,inferred,606.0
OBS_821,SACEL/MURES (ROM) (Intensity V),24.98,46.38,macroseismic,0.055286,0.8059,,620.21,inferred,470.0
OBS_809,PRAID (ROM) (Intensity V),25.127,46.553,macroseismic,0.055272,0.8059,,525.62,inferred,430.0
OBS_794,OLTET/BRUIU (ROM) (Intensity V),24.762,45.803,macroseismic,0.055263,0.8059,,362.67,inferred,381.0
OBS_843,SOIMUSU_MARE (ROM) (Intensity V),24.926,46.347,macroseismic,0.055121,0.8059,,585.94,inferred,475.0
OBS_837,SIGHISOARA2 (ROM) (Intensity V),24.857,46.23,macroseismic,0.055119,0.8059,,447.86,inferred,452.0
OBS_664,BORSEC (ROM) (Intensity V),25.56,46.964,macroseismic,0.054956,0.8059,,424.11,inferred,492.0
OBS_765,MERGHINDEAL (ROM) (Intensity V),24.73,45.965,macroseismic,0.054934,0.8059,,381.94,inferred,382.0
OBS_673,BRUIU (ROM) (Intensity V),24.7,45.876,macroseismic,0.054847,0.8059,,454.58,inferred,264.0
OBS_866,UCEA_DE_SUS (ROM) (Intensity V),24.684,45.753,macroseismic,0.054803,0.8059,,393.83,inferred,353.0
OBS_836,SIGHISOARA1 (ROM) (Intensity V),24.792,46.217,macroseismic,0.054798,0.8059,,638.04,inferred,496.0
OBS_715,HINCESTI(KOTOVSK) (MLD) (Intensity V),28.59,46.83,macroseismic,0.05465,0.8059,,853.93,inferred,270.0
OBS_643,ARPASU_DE_JOS1 (ROM) (Intensity V),24.618,45.778,macroseismic,0.054413,0.8059,,368.15,inferred,341.0
OBS_862,TOPLITA (ROM) (Intensity V),25.353,46.924,macroseismic,0.05441,0.8059,,414.44,inferred,291.0
OBS_644,ARPASU_DE_JOS2 (ROM) (Intensity V),24.614,45.742,macroseismic,0.054393,0.8059,,370.83,inferred,361.0
OBS_825,SANGEORGIU_DE_PADURE (ROM) (Intensity V),24.841,46.433,macroseismic,0.054387,0.8059,,598.43,inferred,563.0
OBS_878,VETCA (ROM) (Intensity V),24.784,46.356,macroseismic,0.05436,0.8059,,450.46,inferred,318.0
OBS_638,AGNITA (ROM) (Intensity V),24.617,45.973,macroseismic,0.054282,0.8059,,262.72,inferred,288.0
OBS_662,BORCA (ROM) (Intensity V),25.787,47.18,macroseismic,0.054254,0.8059,,542.73,inferred,532.0
OBS_683,CHIRPAR (ROM) (Intensity V),24.598,45.894,macroseismic,0.054249,0.8059,,366.33,inferred,386.0
OBS_685,CICANESTI (ROM) (Intensity V),24.605,45.225,macroseismic,0.053682,0.8059,,436.03,inferred,352.0
OBS_672,BROSTENI (ROM) (Intensity V),25.696,47.235,macroseismic,0.053646,0.8059,,583.96,inferred,584.0
OBS_816,REZENI (MLD) (Intensity V),28.9,46.77,macroseismic,0.053557,0.8059,,840.56,inferred,841.0
OBS_808,PORUMBACU_DE_JOS (ROM) (Intensity V),24.457,45.761,macroseismic,0.053523,0.8059,,298.07,inferred,312.0
OBS_640,ALTINA (ROM) (Intensity V),24.464,45.93,macroseismic,0.053499,0.8059,,339.87,inferred,340.0
OBS_823,SALATRUCU1 (ROM) (Intensity V),24.517,45.313,macroseismic,0.053409,0.8059,,735.33,inferred,545.0
OBS_646,AVRIG (ROM) (Intensity V),24.379,45.725,macroseismic,0.05311,0.8059,,290.51,inferred,311.0
OBS_758,MALINI (ROM) (Intensity V),25.993,47.418,macroseismic,0.053093,0.8059,,660.27,inferred,675.0
OBS_849,STRASENI (MLD) (Intensity V),28.61,47.14,macroseismic,0.052851,0.8059,,884.33,inferred,884.0
OBS_865,TURNU_ROSU_TALMACIU (ROM) (Intensity V),24.305,45.663,macroseismic,0.052713,0.8059,,577.84,inferred,513.0
OBS_822,SALATRUCEL (ROM) (Intensity V),24.392,45.25,macroseismic,0.052644,0.8059,,574.47,inferred,312.0
OBS_677,CAINENI_MARI (ROM) (Intensity V),24.303,45.493,macroseismic,0.052573,0.8059,,801.66,inferred,572.0
OBS_854,TALMACIU (ROM) (Intensity V),24.263,45.67,macroseismic,0.052508,0.8059,,422.08,inferred,422.0
OBS_681,CAPU_CAMPULUI (ROM) (Intensity V),25.982,47.506,macroseismic,0.052492,0.8059,,551.66,inferred,565.0
