OBS_1048,IBANESTI/MURES1 (ROM) (Intensity IV),24.932,46.771,macroseismic,0.019366,0.8059,,437.35,inferred,345.0
OBS_1204,SUPLAC/MURES (ROM) (Intensity IV),24.52,46.395,macroseismic,0.018989,0.8059,,548.2,inferred,233.0
OBS_1007,DARLOS (ROM) (Intensity IV),24.412,46.19,macroseismic,0.01893,0.8059,,492.92,inferred,400.0
OBS_945,BAHNEA (ROM) (Intensity IV),24.475,46.371,macroseismic,0.018865,0.8059,,482.76,inferred,384.0
OBS_1044,HODAC (ROM) (Intensity IV),24.763,46.769,macroseismic,0.018795,0.8059,,317.06,inferred,317.0
OBS_1037,GORNESTI1 (ROM) (Intensity IV),24.653,46.672,macroseismic,0.018742,0.8059,,579.22,inferred,229.0
OBS_1113,MEDIAS (ROM) (Intensity IV),24.351,46.164,macroseismic,0.01872,0.8059,,375.68,inferred,292.0
OBS_1049,IDECIU_DE_JOS (ROM) (Intensity IV),24.761,46.81,macroseismic,0.018651,0.8059,,542.33,inferred,446.0
OBS_1006,CRISTESTI (ROM) (Intensity IV),24.49,46.501,macroseismic,0.018632,0.8059,,461.41,inferred,383.0
OBS_1239,VOIVODENI (ROM) (Intensity IV),24.626,46.706,macroseismic,0.018546,0.8059,,328.48,inferred,337.0
OBS_1205,SUSENI/MURES (ROM) (Intensity IV),24.732,46.814,macroseismic,0.018544,0.8059,,230.79,inferred,335.0
OBS_1175,SARU_DORNEI (ROM) (Intensity IV),25.369,47.292,macroseismic,0.018514,0.8059,,511.05,inferred,447.0
OBS_1145,PANET (ROM) (Intensity IV),24.467,46.557,macroseismic,0.018413,0.8059,,375.13,inferred,305.0
OBS_988,CARTIER_COPSA_SAT (ROM) (Intensity IV),24.257,46.118,macroseismic,0.018404,0.8059,,520.39,inferred,438.0
OBS_942,AXENTE_SEVER (ROM) (Intensity IV),24.214,46.092,macroseismic,0.018263,0.8059,,449.58,inferred,463.0
OBS_1034,GLODENI (ROM) (Intensity IV),24.528,46.693,macroseismic,0.01826,0.8059,,465.11,inferred,502.0
OBS_1208,TARNAVENI (ROM) (Intensity IV),24.283,46.331,macroseismic,0.018218,0.8059,,581.98,inferred,509.0
OBS_949,BATOS (ROM) (Intensity IV),24.654,46.883,macroseismic,0.018078,0.8059,,324.09,inferred,327.0
OBS_947,BAND1 (ROM) (Intensity IV),24.381,46.58,macroseismic,0.018063,0.8059,,454.27,inferred,460.0
OBS_1014,DORNA_CANDRENILOR (ROM) (Intensity IV),25.25,47.356,macroseismic,0.017963,0.8059,,900.0,inferred,575.0
OBS_1179,SEICA_MICA1 (ROM) (Intensity IV),24.126,46.057,macroseismic,0.017962,0.8059,,563.23,inferred,453.0
OBS_1108,LUNCA/BISTRITA (ROM) (Intensity IV),24.578,46.849,macroseismic,0.017953,0.8059,,455.49,inferred,445.0
OBS_1100,LOAMNES (ROM) (Intensity IV),24.085,45.941,macroseismic,0.017873,0.8059,,272.47,inferred,506.0
OBS_1054,IZVORUL_GIUMALAULUI (ROM) (Intensity IV),25.446,47.481,macroseismic,0.017813,0.8059,,729.08,inferred,834.0
OBS_986,CAMPULUNG_MOLDOVENESC (ROM) (Intensity IV),25.56,47.529,macroseismic,0.017798,0.8059,,610.68,inferred,794.0
OBS_1155,POJORATA (ROM) (Intensity IV),25.466,47.523,macroseismic,0.017662,0.8059,,900.0,inferred,571.0
OBS_1177,SCOROBOAIE (ROM) (Intensity IV),24.374,46.776,macroseismic,0.017551,0.8059,,374.3,inferred,389.0
OBS_1210,TEACA1 (ROM) (Intensity IV),24.504,46.912,macroseismic,0.017548,0.8059,,520.07,inferred,424.0
OBS_1221,URMENIS (ROM) (Intensity IV),24.364,46.769,macroseismic,0.017539,0.8059,,374.3,inferred,374.0
OBS_1194,SONA1 (ROM) (Intensity IV),24.016,46.216,macroseismic,0.017429,0.8059,,500.57,inferred,517.0
OBS_941,ATINTIS-BICHIS (ROM) (Intensity IV),24.083,46.391,macroseismic,0.017428,0.8059,,492.66,inferred,453.0
OBS_1195,SONA2 (ROM) (Intensity IV),23.98,46.205,macroseismic,0.017319,0.8059,,529.52,inferred,485.0
OBS_1176,SATU_NOU (ROM) (Intensity IV),24.628,47.111,macroseismic,0.017315,0.8059,,447.56,inferred,426.0
OBS_1227,VATRA_MOLDOVITEI (ROM) (Intensity IV),25.577,47.645,macroseismic,0.017301,0.8059,,601.25,inferred,530.0
OBS_1160,PRUNDU_BIRGAULUI (ROM) (Intensity IV),24.74,47.22,macroseismic,0.017262,0.8059,,589.11,inferred,349.0
OBS_1022,FARAU (ROM) (Intensity IV),24.006,46.341,macroseismic,0.017247,0.8059,,525.67,inferred,300.0
OBS_1105,LUDOS (ROM) (Intensity IV),23.898,45.926,macroseismic,0.017216,0.8059,,368.2,inferred,262.0
OBS_1058,JOSENII_BARGAULUI (ROM) (Intensity IV),24.686,47.215,macroseismic,0.017144,0.8059,,641.17,inferred,373.0
OBS_1171,SANMIHAIU_DE_CAMPIE (ROM) (Intensity IV),24.333,46.895,macroseismic,0.017118,0.8059,,404.8,inferred,277.0
OBS_1123,MOLDOVITA (ROM) (Intensity IV),25.545,47.679,macroseismic,0.017106,0.8059,,702.63,inferred,664.0
OBS_1173,SARMASU (ROM) (Intensity IV),24.166,46.754,macroseismic,0.016994,0.8059,,403.75,inferred,508.0
OBS_1099,LIVEZILE (ROM) (Intensity IV),24.574,47.181,macroseismic,0.016967,0.8059,,462.17,inferred,433.0
OBS_1116,MERCUREA (ROM) (Intensity IV),23.794,45.89,macroseismic,0.016878,0.8059,,477.44,inferred,386.0
OBS_998,CHIOCHIS2 (ROM) (Intensity IV),24.231,46.888,macroseismic,0.016858,0.8059,,453.04,inferred,420.0
OBS_984,CAMARASU (ROM) (Intensity IV),24.128,46.787,macroseismic,0.016813,0.8059,,458.21,inferred,406.0
OBS_1197,SPRING/ALBA (ROM) (Intensity IV),23.777,45.975,macroseismic,0.016802,0.8059,,458.31,inferred,459.0
OBS_1027,FRATA1 (ROM) (Intensity IV),24.061,46.705,macroseismic,0.016798,0.8059,,358.27,inferred,403.0
OBS_1015,DOSTAT (ROM) (Intensity IV),23.773,45.962,macroseismic,0.016793,0.8059,,458.31,inferred,432.0
OBS_1102,LOPADEA_NOUA (ROM) (Intensity IV),23.817,46.292,macroseismic,0.016705,0.8059,,623.99,inferred,512.0
OBS_1003,CRACIUNELU_DE_JOS (ROM) (Intensity IV),23.763,46.146,macroseismic,0.016667,0.8059,,505.65,inferred,466.0
OBS_1028,GARBOVA/ALBA (ROM) (Intensity IV),23.723,45.86,macroseismic,0.016654,0.8059,,478.76,inferred,480.0
OBS_1220,UNIREA (ROM) (Intensity IV),23.821,46.403,macroseismic,0.01659,0.8059,,383.79,inferred,395.0
OBS_980,BUZA (ROM) (Intensity IV),24.148,46.909,macroseismic,0.016587,0.8059,,463.08,inferred,402.0
OBS_989,CEANU_MARE (ROM) (Intensity IV),23.956,46.663,macroseismic,0.016581,0.8059,,328.33,inferred,399.0
OBS_985,CAMPIA_TURZII (ROM) (Intensity IV),23.886,46.546,macroseismic,0.016579,0.8059,,280.08,inferred,271.0
OBS_1121,MOCIU1 (ROM) (Intensity IV),24.031,46.796,macroseismic,0.016528,0.8059,,326.39,inferred,326.0
OBS_997,CHIOCHIS1 (ROM) (Intensity IV),24.179,46.982,macroseismic,0.01649,0.8059,,417.07,inferred,401.0
OBS_983,CALNIC (ROM) (Intensity IV),23.658,45.888,macroseismic,0.016448,0.8059,,270.67,inferred,390.0
OBS_1163,RADESTI/AIUD (ROM) (Intensity IV),23.722,46.273,macroseismic,0.016437,0.8059,,261.98,inferred,255.0
OBS_1162,PUTNA/SUCEAVA (ROM) (Intensity IV),25.611,47.871,macroseismic,0.016394,0.8059,,656.18,inferred,681.0
OBS_1203,SUGAG (ROM) (Intensity IV),23.621,45.777,macroseismic,0.016337,0.8059,,785.69,inferred,361.0
OBS_1235,VICOVU_DE_SUS2 (ROM) (Intensity IV),25.697,47.914,macroseismic,0.016316,0.8059,,494.31,inferred,291.0
OBS_1118,MIRASLAU (ROM) (Intensity IV),23.706,46.362,macroseismic,0.0163,0.8059,,555.38,inferred,439.0
OBS_1217,TURDA (ROM) (Intensity IV),23.793,46.562,macroseismic,0.01629,0.8059,,444.95,inferred,304.0
OBS_981,CAIANU (ROM) (Intensity IV),23.917,46.783,macroseismic,0.01625,0.8059,,487.98,inferred,556.0
OBS_1207,TAGA1 (ROM) (Intensity IV),24.043,46.942,macroseismic,0.016243,0.8059,,468.78,inferred,487.0
OBS_1178,SEBES/ALBA1 (ROM) (Intensity IV),23.569,45.954,macroseismic,0.016168,0.8059,,277.57,inferred,260.0
OBS_934,ALBA_IULIA (ROM) (Intensity IV),23.58,46.076,macroseismic,0.016156,0.8059,,318.45,inferred,292.0
OBS_973,BRODINA_DE_JOS (ROM) (Intensity IV),25.407,47.88,macroseismic,0.016111,0.8059,,900.0,inferred,607.0
OBS_1000,COJOCNA (ROM) (Intensity IV),23.831,46.751,macroseismic,0.016084,0.8059,,389.0,inferred,519.0
OBS_1122,MOLDOVENESTI (ROM) (Intensity IV),23.682,46.511,macroseismic,0.016055,0.8059,,502.79,inferred,387.0
OBS_1153,PODENI (ROM) (Intensity IV),23.642,46.427,macroseismic,0.016047,0.8059,,531.7,inferred,414.0
OBS_1035,GLYBOKAIA (UKR) (Intensity IV),25.92,48.09,macroseismic,0.015819,0.8059,,414.41,inferred,661.0
OBS_1085,KRASNOIL'SK (UKR) (Intensity IV),25.57,48.02,macroseismic,0.015775,0.8059,,457.19,inferred,386.0
OBS_1209,TARTARIA (ROM) (Intensity IV),23.411,45.934,macroseismic,0.015721,0.8059,,326.99,inferred,376.0
OBS_1202,STOROZHYNETS (UKR) (Intensity IV),25.71,48.16,macroseismic,0.015394,0.8059,,285.97,inferred,234.0
OBS_1167,ROMOS (ROM) (Intensity IV),23.276,45.84,macroseismic,0.015365,0.8059,,454.95,inferred,448.0
OBS_1223,VALEA_COCESTI (ROM) (Intensity IV),23.283,46.291,macroseismic,0.015222,0.8059,,532.98,inferred,680.0
OBS_1255,ZLATNA (ROM) (Intensity IV),23.231,46.107,macroseismic,0.015193,0.8059,,764.76,inferred,353.0
OBS_1031,GEOAGIU1 (ROM) (Intensity IV),23.207,45.92,macroseismic,0.015181,0.8059,,610.6,inferred,565.0
OBS_1140,ORASTIE (ROM) (Intensity IV),23.197,45.842,macroseismic,0.015161,0.8059,,305.41,inferred,290.0
OBS_972,BRICENI (MLD) (Intensity IV),27.085,48.363,macroseismic,0.015072,0.8059,,497.28,inferred,763.0
OBS_1198,STARA_ZHADOVA (UKR) (Intensity IV),25.5,48.211,macroseismic,0.015038,0.8059,,511.1,inferred,395.0
OBS_956,BEREGOMET (UKR) (Intensity IV),25.34,48.18,macroseismic,0.01499,0.8059,,618.95,inferred,470.0
OBS_969,BOSOROD (ROM) (Intensity IV),23.091,45.684,macroseismic,0.014878,0.8059,,389.91,inferred,334.0
OBS_1161,PUI (ROM) (Intensity IV),23.092,45.518,macroseismic,0.014826,0.8059,,598.21,inferred,398.0
OBS_971,BRETEA_ROMANA (ROM) (Intensity IV),23.016,45.661,macroseismic,0.014693,0.8059,,285.65,inferred,334.0
OBS_982,CALAN (ROM) (Intensity IV),22.993,45.741,macroseismic,0.014653,0.8059,,259.45,inferred,476.0
OBS_1189,SLAVNE/KRYM (UKR) (Intensity IV),33.238,45.722,macroseismic,0.014633,0.8059,,313.96,inferred,317.0
OBS_1157,POLTAVA (UKR) (Intensity IV),34.54,49.59,macroseismic,0.014633,0.8059,,294.1,inferred,254.0
OBS_1246,VYZHNYTSA (UKR) (Intensity IV),25.18,48.25,macroseismic,0.014633,0.8059,,736.11,inferred,414.0
OBS_1215,TOKMAK (UKR) (Intensity IV),35.7,47.25,macroseismic,0.014633,0.8059,,760.0,inferred,272.0
OBS_1136,OBOLONI (UKR) (Intensity IV),32.87,49.6,macroseismic,0.014633,0.8059,,337.8,inferred,338.0
OBS_948,BANLOC (ROM) (Intensity IV),21.114,45.38,macroseismic,0.014633,0.8059,,180.0,inferred,210.0
OBS_1082,KOZELETS (UKR) (Intensity IV),31.11,50.91,macroseismic,0.014633,0.8059,,284.92,inferred,243.0
OBS_1232,VERMES (ROM) (Intensity IV),21.651,45.518,macroseismic,0.014633,0.8059,,403.72,inferred,309.0
OBS_1144,OSTROG (UKR) (Intensity IV),26.52,50.33,macroseismic,0.014633,0.8059,,499.92,inferred,655.0
OBS_976,BUCHACH (UKR) (Intensity IV),25.39,49.07,macroseismic,0.014633,0.8059,,557.34,inferred,781.0
OBS_1114,MENA (UKR) (Intensity IV),32.21,51.52,macroseismic,0.014633,0.8059,,232.92,inferred,272.0
OBS_1107,LUGOVOE (UKR) (Intensity IV),35.38,47.5,macroseismic,0.014633,0.8059,,373.22,inferred,321.0
OBS_1023,FARDEA (ROM) (Intensity IV),22.16,45.736,macroseismic,0.014633,0.8059,,574.45,inferred,337.0
OBS_957,BEREZANI (UKR) (Intensity IV),31.47,50.31,macroseismic,0.014633,0.8059,,330.62,inferred,238.0
OBS_1083,KRASNOARMEYSK (UKR) (Intensity IV),37.18,48.28,macroseismic,0.014633,0.8059,,760.0,inferred,272.0
OBS_955,BEREGDARO'C (HUN) (Intensity IV),22.53,48.196,macroseismic,0.014633,0.8059,,198.07,inferred,198.0
OBS_1192,SNIHURIVKA (UKR) (Intensity IV),32.791,47.07,macroseismic,0.014633,0.8059,,427.07,inferred,435.0
OBS_990,CERBAL (ROM) (Intensity IV),22.713,45.78,macroseismic,0.014633,0.8059,,483.91,inferred,314.0
OBS_1004,CRAGUIS (ROM) (Intensity IV),22.889,45.626,macroseismic,0.014633,0.8059,,478.16,inferred,564.0
OBS_1069,KIROVSKE/KRYM (UKR) (Intensity IV),33.08,45.544,macroseismic,0.014633,0.8059,,266.27,inferred,355.0
OBS_1092,KURAKHIVKA (UKR) (Intensity IV),37.375,48.028,macroseismic,0.014633,0.8059,,760.0,inferred,900.0
OBS_1053,IVANO-FRANKOVSK (UKR) (Intensity IV),24.71,48.925,macroseismic,0.014633,0.8059,,273.17,inferred,344.0
OBS_1061,KALANCHAK/KHERS. (UKR) (Intensity IV),33.29,46.255,macroseismic,0.014633,0.8059,,268.57,inferred,297.0
OBS_1222,USTYVITSYA (UKR) (Intensity IV),33.844,49.861,macroseismic,0.014633,0.8059,,566.71,inferred,264.0
OBS_1050,INKERMAN (UKR) (Intensity IV),33.607,44.604,macroseismic,0.014633,0.8059,,681.44,inferred,367.0
OBS_1159,PRILUKI (UKR) (Intensity IV),32.385,50.596,macroseismic,0.014633,0.8059,,447.83,inferred,416.0
OBS_1040,GREBENKA (UKR) (Intensity IV),32.44,50.12,macroseismic,0.014633,0.8059,,264.88,inferred,246.0
OBS_1033,GLOBINO (UKR) (Intensity IV),33.26,49.39,macroseismic,0.014633,0.8059,,277.48,inferred,235.0
OBS_1213,TICVANIU_MARE (ROM) (Intensity IV),21.638,45.139,macroseismic,0.014633,0.8059,,303.73,inferred,384.0
OBS_1212,TERNOPIL (UKR) (Intensity IV),25.6,49.566,macroseismic,0.014633,0.8059,,487.1,inferred,487.0
OBS_1065,KAMIANKA/KHMEL. (UKR) (Intensity IV),32.1,49.035,macroseismic,0.014633,0.8059,,406.73,inferred,407.0
OBS_1181,SEMENIVKA (UKR) (Intensity IV),33.18,49.6,macroseismic,0.014633,0.8059,,223.27,inferred,223.0
OBS_951,BE'KE'S (HUN) (Intensity IV),21.128,46.774,macroseismic,0.014633,0.8059,,208.38,inferred,202.0
OBS_968,BORZNA (UKR) (Intensity IV),32.43,51.25,macroseismic,0.014633,0.8059,,235.87,inferred,228.0
OBS_1073,KOMSOMOLSK (UKR) (Intensity IV),33.64,49.01,macroseismic,0.014633,0.8059,,338.39,inferred,237.0
OBS_1201,STARYI_KRYM (UKR) (Intensity IV),35.09,45.03,macroseismic,0.014633,0.8059,,475.99,inferred,490.0
OBS_1001,CONSTANTIN_DAICOVICIU (ROM) (Intensity IV),22.15,45.548,macroseismic,0.014633,0.8059,,232.11,inferred,271.0
OBS_1135,NYZHNEHIRSKYI (UKR) (Intensity IV),34.736,45.449,macroseismic,0.014633,0.8059,,189.42,inferred,217.0
OBS_1110,LUTSK (UKR) (Intensity IV),25.34,50.75,macroseismic,0.014633,0.8059,,526.5,inferred,339.0
OBS_1046,HOROL (UKR) (Intensity IV),33.28,49.78,macroseismic,0.014633,0.8059,,716.11,inferred,659.0
OBS_1141,OREKHOV/ZAPOR. (UKR) (Intensity IV),35.783,47.567,macroseismic,0.014633,0.8059,,760.0,inferred,412.0
OBS_1013,DONETSK (UKR) (Intensity IV),37.81,47.99,macroseismic,0.014633,0.8059,,760.0,inferred,666.0
OBS_1059,KACHA (UKR) (Intensity IV),33.54,44.77,macroseismic,0.014633,0.8059,,600.0,inferred,403.0
OBS_935,ALEKSANDRIA (UKR) (Intensity IV),33.11,48.67,macroseismic,0.014633,0.8059,,274.41,inferred,414.0
OBS_1231,VERHNEDNEPROVSK (UKR) (Intensity IV),34.32,48.65,macroseismic,0.014633,0.8059,,900.0,inferred,433.0
OBS_1193,SOIMUS (ROM) (Intensity IV),22.876,45.919,macroseismic,0.014633,0.8059,,572.74,inferred,378.0
OBS_999,CHIORTKOV (UKR) (Intensity IV),25.8,49.01,macroseismic,0.014633,0.8059,,553.28,inferred,572.0
OBS_937,ANDRUSHEVKA (UKR) (Intensity IV),29.03,50.03,macroseismic,0.014633,0.8059,,238.51,inferred,239.0
OBS_953,BELOGORSK (UKR) (Intensity IV),34.6,45.052,macroseismic,0.014633,0.8059,,333.31,inferred,304.0
OBS_1025,FEODOSIA (UKR) (Intensity IV),35.38,45.04,macroseismic,0.014633,0.8059,,521.42,inferred,351.0
OBS_1226,VASYLIVKA(TAVRICHESK) (UKR) (Intensity IV),35.279,47.44,macroseismic,0.014633,0.8059,,737.74,inferred,600.0
OBS_1258,ZUIA (UKR) (Intensity IV),34.317,45.055,macroseismic,0.014633,0.8059,,381.05,inferred,380.0
OBS_996,CHIGIRIN (UKR) (Intensity IV),32.65,49.08,macroseismic,0.014633,0.8059,,895.52,inferred,589.0
OBS_1228,VELYKA_BAGACHKA (UKR) (Intensity IV),33.72,49.78,macroseismic,0.014633,0.8059,,900.0,inferred,790.0
OBS_1156,POLONNOYE (UKR) (Intensity IV),27.51,50.12,macroseismic,0.014633,0.8059,,315.08,inferred,322.0
OBS_1225,VASILIKOV (UKR) (Intensity IV),30.32,50.18,macroseismic,0.014633,0.8059,,489.45,inferred,819.0
OBS_970,BOZOVICI2 (ROM) (Intensity IV),22.004,44.926,macroseismic,0.014633,0.8059,,565.67,inferred,411.0
OBS_1247,YAGOTIN (UKR) (Intensity IV),31.77,50.28,macroseismic,0.014633,0.8059,,307.08,inferred,409.0
OBS_943,BAHATE/KRYM (UKR) (Intensity IV),34.766,45.028,macroseismic,0.014633,0.8059,,385.2,inferred,501.0
OBS_1066,KARCAG (HUN) (Intensity IV),20.919,47.315,macroseismic,0.014633,0.8059,,211.78,inferred,196.0
OBS_1134,NOVOVORONTSOVKA (UKR) (Intensity IV),33.92,47.5,macroseismic,0.014633,0.8059,,600.0,inferred,876.0
OBS_944,BAHMACH (UKR) (Intensity IV),32.81,51.18,macroseismic,0.014633,0.8059,,245.11,inferred,235.0
OBS_1234,VETEL (ROM) (Intensity IV),22.802,45.907,macroseismic,0.014633,0.8059,,544.69,inferred,284.0
OBS_936,ALUPKA (UKR) (Intensity IV),34.05,44.42,macroseismic,0.014633,0.8059,,900.0,inferred,724.0
OBS_1148,PEREMYSHLIANY (UKR) (Intensity IV),24.55,49.67,macroseismic,0.014633,0.8059,,337.04,inferred,816.0
OBS_1111,MAKO' (HUN) (Intensity IV),20.471,46.222,macroseismic,0.014633,0.8059,,229.79,inferred,228.0
OBS_963,BOBROVYTSA (UKR) (Intensity IV),31.38,50.75,macroseismic,0.014633,0.8059,,299.22,inferred,236.0
OBS_992,CHERKASSY (UKR) (Intensity IV),32.067,49.433,macroseismic,0.014633,0.8059,,324.96,inferred,325.0
OBS_965,BOGODUHOV (UKR) (Intensity IV),35.53,50.16,macroseismic,0.014633,0.8059,,760.0,inferred,331.0
OBS_1093,KURSKOYE (UKR) (Intensity IV),34.938,45.029,macroseismic,0.014633,0.8059,,415.23,inferred,520.0
OBS_1090,KUIBYSHEVO (UKR) (Intensity IV),36.65,47.36,macroseismic,0.014633,0.8059,,760.0,inferred,441.0
OBS_1005,CRISCIOR1 (ROM) (Intensity IV),22.866,46.124,macroseismic,0.014633,0.8059,,524.6,inferred,476.0
OBS_1229,VELYKA_LEPETIKHA (UKR) (Intensity IV),33.94,47.17,macroseismic,0.014633,0.8059,,791.44,inferred,666.0
OBS_1206,SVETLOVODSK (UKR) (Intensity IV),33.223,49.05,macroseismic,0.014633,0.8059,,430.68,inferred,868.0
OBS_1242,VOLODARSK_VOLYNSKIY (UKR) (Intensity IV),28.45,50.6,macroseismic,0.014633,0.8059,,347.16,inferred,230.0
OBS_1132,NOVOOZERNOE (UKR) (Intensity IV),33.12,45.38,macroseismic,0.014633,0.8059,,283.27,inferred,399.0
OBS_1072,KOLOMYIA (UKR) (Intensity IV),25.05,48.53,macroseismic,0.014633,0.8059,,301.52,inferred,300.0
OBS_1142,ORZHITSA (UKR) (Intensity IV),32.7,49.79,macroseismic,0.014633,0.8059,,292.92,inferred,348.0
OBS_974,BROVARY (UKR) (Intensity IV),30.79,50.51,macroseismic,0.014633,0.8059,,370.2,inferred,388.0
OBS_932,AHTYRKA (UKR) (Intensity IV),34.9,50.31,macroseismic,0.014633,0.8059,,233.62,inferred,223.0
OBS_991,CHEMEROVTSI (UKR) (Intensity IV),26.35,49.02,macroseismic,0.014633,0.8059,,474.06,inferred,693.0
OBS_1042,HATEG (ROM) (Intensity IV),22.948,45.608,macroseismic,0.014633,0.8059,,273.18,inferred,340.0
OBS_1254,ZHOVTNEVE(NOVOVOLINSK) (UKR) (Intensity IV),24.25,50.664,macroseismic,0.014633,0.8059,,556.6,inferred,439.0
OBS_1257,ZOLOTONOSHA (UKR) (Intensity IV),32.04,49.67,macroseismic,0.014633,0.8059,,271.13,inferred,395.0
OBS_1011,DOBROPILIIA (UKR) (Intensity IV),37.087,48.469,macroseismic,0.014633,0.8059,,760.0,inferred,548.0
OBS_978,BUCURESCI/CRISCIOR (ROM) (Intensity IV),22.901,46.128,macroseismic,0.014633,0.8059,,578.83,inferred,449.0
OBS_1249,ZALESHCHIKI (UKR) (Intensity IV),25.74,48.64,macroseismic,0.014633,0.8059,,785.37,inferred,765.0
OBS_1104,LUBNY (UKR) (Intensity IV),33.0,50.02,macroseismic,0.014633,0.8059,,561.61,inferred,260.0
OBS_1250,ZAPOROZHYE (UKR) (Intensity IV),35.14,47.84,macroseismic,0.014633,0.8059,,900.0,inferred,687.0
OBS_1237,VLADIMIRETS (UKR) (Intensity IV),26.14,51.42,macroseismic,0.014633,0.8059,,291.31,inferred,421.0
OBS_1095,LAZAREVAC_1 (SRB) (Intensity IV),21.157,43.674,macroseismic,0.014633,0.8059,,435.42,inferred,365.0
OBS_1076,KOROP (UKR) (Intensity IV),32.95,51.545,macroseismic,0.014633,0.8059,,221.87,inferred,229.0
OBS_1017,DUBROVITSA (UKR) (Intensity IV),26.57,51.57,macroseismic,0.014633,0.8059,,445.65,inferred,446.0
OBS_1211,TEREBOVLIA (UKR) (Intensity IV),25.7,49.3,macroseismic,0.014633,0.8059,,862.71,inferred,863.0
OBS_1137,OLEKSANDRIVKA/DON. (UKR) (Intensity IV),36.913,48.708,macroseismic,0.014633,0.8059,,760.0,inferred,763.0
OBS_1120,MIRONIVKA (UKR) (Intensity IV),30.983,49.65,macroseismic,0.014633,0.8059,,773.79,inferred,436.0
OBS_1036,GOLAIA_PRISTANY (UKR) (Intensity IV),32.53,46.52,macroseismic,0.014633,0.8059,,195.47,inferred,288.0
OBS_1149,PEREYASLAV_KHMELINITSKIY (UKR) (Intensity IV),31.46,50.07,macroseismic,0.014633,0.8059,,297.48,inferred,251.0
OBS_1251,ZBARAZH (UKR) (Intensity IV),25.77,49.66,macroseismic,0.014633,0.8059,,641.4,inferred,631.0
OBS_1168,ROSCANI (ROM) (Intensity IV),22.563,45.862,macroseismic,0.014633,0.8059,,566.66,inferred,743.0
OBS_1174,SARNY (UKR) (Intensity IV),26.61,51.33,macroseismic,0.014633,0.8059,,283.26,inferred,309.0
OBS_1199,STAROBOHDANIVKA (UKR) (Intensity IV),35.489,47.116,macroseismic,0.014633,0.8059,,229.24,inferred,900.0
OBS_1128,NOSOVKA (UKR) (Intensity IV),31.58,50.95,macroseismic,0.014633,0.8059,,274.59,inferred,278.0
OBS_1060,KAHARLYK (UKR) (Intensity IV),30.83,49.85,macroseismic,0.014633,0.8059,,413.36,inferred,686.0
OBS_1020,DZHANKOY (UKR) (Intensity IV),34.4,45.71,macroseismic,0.014633,0.8059,,325.0,inferred,243.0
OBS_1084,KRASNOHVARDIISKE (UKR) (Intensity IV),34.3,45.5,macroseismic,0.014633,0.8059,,254.74,inferred,255.0
OBS_1106,LUGOJ (ROM) (Intensity IV),21.906,45.685,macroseismic,0.014633,0.8059,,234.16,inferred,212.0
OBS_1078,KORSUN-SHEVCHENKOVSKYI (UKR) (Intensity IV),31.27,49.415,macroseismic,0.014633,0.8059,,797.85,inferred,343.0
OBS_1089,KRYNICHKI (UKR) (Intensity IV),34.47,48.37,macroseismic,0.014633,0.8059,,319.08,inferred,319.0
OBS_1152,PETROVE (UKR) (Intensity IV),33.264,48.335,macroseismic,0.014633,0.8059,,795.54,inferred,796.0
OBS_1052,IVANIVKA/KHERS. (UKR) (Intensity IV),34.55,46.72,macroseismic,0.014633,0.8059,,234.12,inferred,238.0
OBS_1165,RIVNE (UKR) (Intensity IV),26.24,50.62,macroseismic,0.014633,0.8059,,528.78,inferred,284.0
OBS_995,CHERVONOARMEYSK (UKR) (Intensity IV),25.26,50.13,macroseismic,0.014633,0.8059,,318.15,inferred,314.0
OBS_1216,TSURIUPINSK (UKR) (Intensity IV),32.71,46.61,macroseismic,0.014633,0.8059,,259.29,inferred,274.0
OBS_1248,YUZHNOUKRAINSK (UKR) (Intensity IV),31.178,47.824,macroseismic,0.014633,0.8059,,856.55,inferred,900.0
OBS_1088,KREMENETZ (UKR) (Intensity IV),25.74,50.1,macroseismic,0.014633,0.8059,,900.0,inferred,900.0
OBS_1097,LENINO(SEM_KOLODEZEY) (UKR) (Intensity IV),35.744,45.297,macroseismic,0.014633,0.8059,,760.0,inferred,274.0
OBS_1119,MIRGOROD (UKR) (Intensity IV),33.61,49.96,macroseismic,0.014633,0.8059,,228.0,inferred,275.0
OBS_1138,OLENEVKA (UKR) (Intensity IV),32.53,45.38,macroseismic,0.014633,0.8059,,544.54,inferred,294.0
OBS_1127,NIZHYN (UKR) (Intensity IV),31.886,51.038,macroseismic,0.014633,0.8059,,215.54,inferred,225.0
OBS_1024,FASTOV (UKR) (Intensity IV),29.91,50.08,macroseismic,0.014633,0.8059,,679.24,inferred,679.0
OBS_938,ARANEIS (ROM) (Intensity IV),22.731,45.795,macroseismic,0.014633,0.8059,,422.6,inferred,553.0
OBS_1130,NOVGOROD_SEVERSKIY (UKR) (Intensity IV),33.27,52.0,macroseismic,0.014633,0.8059,,415.77,inferred,416.0
OBS_1219,TYSMENITSA (UKR) (Intensity IV),24.85,48.9,macroseismic,0.014633,0.8059,,298.01,inferred,267.0
OBS_1056,JABLANKA (SRB) (Intensity IV),21.388,45.074,macroseismic,0.014633,0.8059,,295.91,inferred,276.0
OBS_1139,OLEVSK (UKR) (Intensity IV),27.645,51.22,macroseismic,0.014633,0.8059,,431.59,inferred,242.0
OBS_1230,VERENDIN1 (ROM) (Intensity IV),22.23,45.08,macroseismic,0.014633,0.8059,,410.08,inferred,540.0
OBS_1019,DYMER (UKR) (Intensity IV),30.32,50.79,macroseismic,0.014633,0.8059,,267.18,inferred,283.0
OBS_1038,GORNIAK (UKR) (Intensity IV),37.37,48.06,macroseismic,0.014633,0.8059,,760.0,inferred,444.0
OBS_1067,KIEV (UKR) (Intensity IV),30.517,50.433,macroseismic,0.014633,0.8059,,782.25,inferred,900.0
OBS_933,AKIMOVKA (UKR) (Intensity IV),35.16,46.69,macroseismic,0.014633,0.8059,,315.48,inferred,399.0
OBS_1002,COSTEIU (ROM) (Intensity IV),21.895,45.746,macroseismic,0.014633,0.8059,,255.33,inferred,304.0
OBS_1151,PETROPAVLOVKA (UKR) (Intensity IV),36.44,48.46,macroseismic,0.014633,0.8059,,760.0,inferred,318.0
OBS_1252,ZENIKOV (UKR) (Intensity IV),34.37,50.21,macroseismic,0.014633,0.8059,,304.81,inferred,359.0
OBS_1041,HARKIV (UKR) (Intensity IV),36.26,49.98,macroseismic,0.014633,0.8059,,760.0,inferred,340.0
OBS_1243,VORTA (ROM) (Intensity IV),22.671,46.025,macroseismic,0.014633,0.8059,,399.01,inferred,521.0
OBS_1077,KOROSTENI (UKR) (Intensity IV),28.64,50.96,macroseismic,0.014633,0.8059,,332.45,inferred,310.0
OBS_1070,KITSMAN (UKR) (Intensity IV),25.762,48.441,macroseismic,0.014633,0.8059,,742.28,inferred,719.0
OBS_1063,KALYNIVKA (UKR) (Intensity IV),28.53,49.452,macroseismic,0.014633,0.8059,,293.98,inferred,462.0
OBS_1169,ROZDOLNE (UKR) (Intensity IV),39.013,49.302,macroseismic,0.014633,0.8059,,760.0,inferred,360.0
OBS_1172,SARKAD (HUN) (Intensity IV),21.377,46.739,macroseismic,0.014633,0.8059,,186.67,inferred,207.0
OBS_1133,NOVOTROITSKOIE (UKR) (Intensity IV),34.33,46.36,macroseismic,0.014633,0.8059,,252.52,inferred,236.0
OBS_1057,JAMU_MARE (ROM) (Intensity IV),21.406,45.253,macroseismic,0.014633,0.8059,,238.29,inferred,257.0
OBS_1043,HERSON (UKR) (Intensity IV),32.62,46.66,macroseismic,0.014633,0.8059,,312.58,inferred,237.0
OBS_1030,GENICHESK (UKR) (Intensity IV),34.81,46.18,macroseismic,0.014633,0.8059,,323.51,inferred,262.0
OBS_993,CHERNIGOV (UKR) (Intensity IV),31.29,51.49,macroseismic,0.014633,0.8059,,306.25,inferred,398.0
OBS_987,CARANSEBES (ROM) (Intensity IV),22.216,45.413,macroseismic,0.014633,0.8059,,545.67,inferred,288.0
OBS_1224,VALEA_DALJII (ROM) (Intensity IV),22.885,45.515,macroseismic,0.014633,0.8059,,475.2,inferred,422.0
OBS_1115,MERCINA (ROM) (Intensity IV),21.539,45.06,macroseismic,0.014633,0.8059,,268.33,inferred,276.0
OBS_967,BORODIANKA (UKR) (Intensity IV),29.94,50.65,macroseismic,0.014633,0.8059,,288.28,inferred,394.0
OBS_1158,PONORNITSA (UKR) (Intensity IV),32.85,51.72,macroseismic,0.014633,0.8059,,231.06,inferred,514.0
OBS_1188,SKADOVSK (UKR) (Intensity IV),32.92,46.12,macroseismic,0.014633,0.8059,,209.83,inferred,226.0
OBS_1081,KOSTOPIL (UKR) (Intensity IV),26.46,50.88,macroseismic,0.014633,0.8059,,298.12,inferred,258.0
OBS_1245,VYSOKOPOLIE (UKR) (Intensity IV),33.54,47.49,macroseismic,0.014633,0.8059,,229.05,inferred,220.0
OBS_1126,NAUCHNIY (UKR) (Intensity IV),34.016,44.726,macroseismic,0.014633,0.8059,,455.26,inferred,409.0
OBS_1103,LOZOVAYA (UKR) (Intensity IV),36.31,48.89,macroseismic,0.014633,0.8059,,760.0,inferred,309.0
OBS_1170,SAKI (UKR) (Intensity IV),33.603,45.14,macroseismic,0.014633,0.8059,,600.0,inferred,296.0
OBS_1075,KORETS (UKR) (Intensity IV),27.153,50.62,macroseismic,0.014633,0.8059,,213.68,inferred,238.0
OBS_1200,STAROKONSTANTYNIV (UKR) (Intensity IV),27.22,49.75,macroseismic,0.014633,0.8059,,397.7,inferred,290.0
